{
  "conversation_id": "b8d4e2f9-6c3a-4b8e-9d7f-2a5c8b4e0f6d",
  "channel": "VOICE",
  "language": "en-AU",
  "started_at": "2025-12-28T15:42:10+11:00",
  "ended_at": "2025-12-28T15:49:30+11:00",
  "duration_sec": 440,
  "turns": [
    { "turn_index": 0, "speaker": "AGENT", "text": "Good afternoon, Example Finance collections, you're speaking with Tom. How can I help?", "ts_offset_sec": 0 },
    { "turn_index": 1, "speaker": "CUSTOMER", "text": "Hi Tom. I got a letter about my overdue account. I want to sort it out.", "ts_offset_sec": 6 },
    { "turn_index": 2, "speaker": "AGENT", "text": "No worries, happy to help with that. Can I start by getting your full name?", "ts_offset_sec": 12 },
    { "turn_index": 3, "speaker": "CUSTOMER", "text": "Emma Rodriguez.", "ts_offset_sec": 18 },
    { "turn_index": 4, "speaker": "AGENT", "text": "Thanks Emma. And can you confirm your date of birth and postcode for me?", "ts_offset_sec": 22 },
    { "turn_index": 5, "speaker": "CUSTOMER", "text": "5th of July 1990. Postcode is 2145.", "ts_offset_sec": 28 },
    { "turn_index": 6, "speaker": "AGENT", "text": "Perfect, thank you. I can see the outstanding amount is $650.00. Were you looking to pay this in full today, or would you prefer to set up a payment plan?", "ts_offset_sec": 36 },
    { "turn_index": 7, "speaker": "CUSTOMER", "text": "I can't do it all at once, but I can definitely do a payment plan. What are my options?", "ts_offset_sec": 48 },
    { "turn_index": 8, "speaker": "AGENT", "text": "Sure. We can be flexible. What sort of amount would work for you on a weekly or fortnightly basis?", "ts_offset_sec": 56 },
    { "turn_index": 9, "speaker": "CUSTOMER", "text": "I could do $50 a week. That would work with my pay cycle.", "ts_offset_sec": 65 },
    { "turn_index": 10, "speaker": "AGENT", "text": "That works perfectly. At $50 a week, you'd have it paid off in about 13 weeks. Would you prefer weekly payments on a particular day?", "ts_offset_sec": 72 },
    { "turn_index": 11, "speaker": "CUSTOMER", "text": "Wednesdays would be best. That's when I get paid.", "ts_offset_sec": 84 },
    { "turn_index": 12, "speaker": "AGENT", "text": "Great, I'll set that up for you. First payment of $50 next Wednesday. I'll send you a confirmation by email. What's the best email address?", "ts_offset_sec": 90 },
    { "turn_index": 13, "speaker": "CUSTOMER", "text": "emma.rodriguez90@yahoo.com", "ts_offset_sec": 102 },
    { "turn_index": 14, "speaker": "AGENT", "text": "Got it. And just to confirm the phone number we have on fileâ€”is 0422 331 556 still the best number?", "ts_offset_sec": 108 },
    { "turn_index": 15, "speaker": "CUSTOMER", "text": "Yes, that's correct.", "ts_offset_sec": 118 },
    { "turn_index": 16, "speaker": "AGENT", "text": "Perfect. So I've set up $50 per week starting next Wednesday. You'll receive an email confirmation shortly. If you ever need to change the arrangement, just give us a call.", "ts_offset_sec": 122 },
    { "turn_index": 17, "speaker": "CUSTOMER", "text": "Thanks Tom. That was easy. I appreciate it.", "ts_offset_sec": 138 },
    { "turn_index": 18, "speaker": "AGENT", "text": "Happy to help, Emma. Thanks for calling and getting this sorted. Have a great day.", "ts_offset_sec": 144 }
  ]
}
